"","Score","Media","Reviewer","Date","Review","Review (Don't)"
"260","89","Absorbing, Great acting, Thought-provoking, Relevant, Riveting  judulucu",""," April 2nd, 2017","See it if You like masterful acting, want to connect with a show.","Don't see it if You don't want to really listen and pay attention.="
"261","75","Intelligent, Thought-provoking  Alexandra 7048",""," March 31st, 2017","See it if you want to see a great performance by Danny Devito","Don't see it if you are not in the mood for a slightly heavy show where the rest of the cast's acting was just eh.="
"262","91","Enchanting, Intelligent, Masterful, Riveting  Helene 6331",""," March 31st, 2017","See it if If you love Arthur Miller's great, moving theater, thought provoking characters with history and depth.","Don't see it if If you're only interested in avant garde theater.=Also Fall in love with Danny DeVito in the very funny first act, delve into layers of truth in the second, as the brothers confront each other. As always, Miller deals in serious, complex matters, always relevant. One caveat, sit near the stage, as some lines or parts of sentences are hard to make out....<U+00A0>Read more Read less="
"263","99","Absorbing, Great acting, Intelligent, Must see, Great writing  Ruth 7071",""," March 30th, 2017","See it if People who like to contemplate what happens in life to families.","Don't see it if You like musicals and dislike heavy drama.="
"264","80","Absorbing, Clever, Great acting  Adrianne K",""," March 30th, 2017","See it if Love good old fashioned theater. DeVito steals the show.","Don't see it if You only go to the theater to see movie stars. Ruffalo is not very good.="
"265","50","Funny, Great acting, Cliched, Slow, Dated  Graeme",""," March 30th, 2017","See it if You want to see a lesser-known Arthur Miller play or are a fan of the cast (especially Danny DeVito).","Don't see it if You don't like plays that drag or feel predictable and theatrical.="
"266","80","Funny, Absorbing  Zachary T",""," March 30th, 2017","See it if You enjoy Arthur Miller or are looking for an easy night at the theatre.","Don't see it if You are hoping for a thought-provoking play.="
"267","77","Great acting  Rach",""," March 30th, 2017","See it if you love Arthur Miller or Danny Devito #eggs","Don't see it if you enjoy more riveting plays, the show made me think but overall it seemed a little monotone="
"268","88","Clever, Great acting, Intelligent, Thought-provoking  Genevieve 6319",""," March 30th, 2017","See it if you're interested in seeing Danny DeVito and Mark Ruffalo live on stage. They both did an excellent job, and elevated the show.","Don't see it if you're looking for a light and funny show.="
"269","78","Disappointing  Alan G 6124",""," March 30th, 2017","See it if Fans of Danny DeVito","Don't see it if You expect a  heavier  Arfhur Miller Play="
"270","82","Great acting, Thought-provoking, Resonant, Great writing, Slow  Kangor",""," March 29th, 2017","See it if you are interested in complex family dynamics.","Don't see it if you need constant excitement. The first act is a slow build, though the second act is rapid fire conflict.="
"271","95","Absorbing, Great acting, Intelligent, Thought-provoking, Great writing  Ron Casalotti",""," March 29th, 2017","See it if You enjoy dramas where the set remains static and the words -- and the acting is the thing.","Don't see it if You are looking for a big Broadway production, this is an intimate intense drama.="
"272","60","Funny, Cliched, Slow, Dated, Great staging  nataliesoto",""," March 29th, 2017","See it if You wanna see Danny devito and mark ruffalo","Don't see it if You get bored easily="
"273","80","Absorbing, Great acting, Intelligent, Thought-provoking, Relevant  Roger 2",""," March 29th, 2017","See it if You like a meaty play by a great playwright acted by four top-notch actors.","Don't see it if You don't like  talky  plays.="
"274","77","Great acting, Intelligent, Slow, Entertaining  Brackett",""," March 29th, 2017","See it if You love an Arthur Miller play. You want to see some Danny DeVito hysterics.","Don't see it if Don't like slow moving plays.="
"275","70","Funny, Absorbing, Intelligent, Dated, Entertaining  Mark 6258",""," March 27th, 2017","See it if you want to see one of Arthur Miller's lesser plays with a great cast.","Don't see it if it will bother you that the play is a bit dated.=Also We had a hard time hearing and understanding Mark Ruffalo and Jessica Hecht. Danny Devito was fabulous....<U+00A0>Read more Read less"
"276","75","Quirky, Banal, Cliched, Overrated, Hilarious  My way or the Broadway",""," March 27th, 2017","See it if You are a fan of Danny Devito's Comedy. His character makes the show worth it","Don't see it if You are not a fan of long monologues that kind of go in circles, and don't entirely resonate on a deep level."
"277","95","Funny, Great acting, Entertaining  Michelle 4",""," March 24th, 2017","See it if You love Danny DeVito, Tony Shalhoub & Mark Ruffalo - a resonant family saga","Don't see it if No reason you shouldn't see it"
"278","95","Gripping, Intense, Well acted, Satisfying, Classic drama  Greg 6234",""," March 23rd, 2017","See it if you like psychologically probing drama","Don't see it if you only like light-hearted plays and musicals=Also Danny DeVito successfully mines the script's potential for comic moments--more than you would typically expect from an Arthur Miller drama.Tony Shalhoub, Jessica Hecht and Mark Ruffalo round out this exceptional cast for a most worthwhile afternoon or evening of theatre....<U+00A0>Read more Read less"
"279","69","Cliched, Slow, Dated  Linda 99",""," March 21st, 2017","See it if The actors are fine especially Danny Devito. See it if, you are a total arthur miller fan no matter what the play","Don't see it if You expect one of miller's better plays, e.g., the crucible or death of a salesman!="
"280","65","Intense, Great writing, Slow  SusanJNYC",""," March 20th, 2017","See it if you are a fan of Arthur Miller. Most of the case is admirable, but the plot is repetitive.","Don't see it if you have high expectations for Mark Ruffalo. His performance is stilted and he had trouble remembering his lines.="
"281","95","Funny, Great acting, Intense, Great writing, Great staging  Haley 7075",""," March 19th, 2017","See it if you love great acting. It's a story that anyone who's ever experienced family drama can relate to. Danny Devito and M Ruffalo are excellent","Don't see it if you have a perfect family.="
"282","77","Absorbing, Intelligent, Profound, Resonant, Great staging  Jake 6266",""," March 19th, 2017","See it if You love your Arthur Miller and are interested in family dynamics.","Don't see it if You want resolution or are expecting the greatness of The Crucible or Death of a Salesman- this is a lesser Miller and it shows=Also The actors are certainly one of the main draws of this show, DeVito especially, and he doesn't disappoint in what is largely a bit role that he excels at. It's not the most neat of stories but still very interesting....<U+00A0>Read more Read less="
"283","75","Funny, Intelligent, Intense, Resonant, Slow  Robin 20",""," March 18th, 2017","See it if You like family dramas","Don't see it if you expect it to be as good as the rest of Miller's plays="
"284","70","Intelligent, Thought-provoking  M Jane",""," May 8th, 2017","See it if you are an Arthur Miller's fan and enjoy his style of plays. You enjoy watching  star studded  shows.","Don't see it if yo don't enjoy a slower first act with a dynamic second act.="
"285","95","Absorbing, Great acting, Intelligent  Jan 6302",""," May 8th, 2017","See it if One the best plays I've seen in years! The acting was outstanding. It's one of those plays that stays with you after it's over.","Don't see it if You don't enjoy serious plays.="
"286","80","Clever, Delightful, Great acting, Intelligent, Relevant  Karina 7052",""," May 7th, 2017","See it if you like classic plays and great acting","Don't see it if you're not interested in family issues="
"287","90","Funny, Absorbing, Intelligent  Bonny C",""," April 27th, 2017","See it if you like thought-provoking drama.","Don't see it if you want a mindless comedy."
"288","85","Absorbing, Great acting, Intense  Tommy L",""," April 26th, 2017","See it if Admire great delivery","Don't see it if Looking for silly"
"289","95","Great acting, Masterful, Must see, Riveting  Cheryl D",""," April 26th, 2017","See it if You want to see a great story with outstanding acting.","Don't see it if You are only interested in musicals."
"290","86","Absorbing, Intelligent, Thought-provoking, Profound, Resonant  Fran 6069",""," April 26th, 2017","See it if You like Arthur Miller and family drama.","Don't see it if You are looking for a light or happy show."
"291","100","Great acting, Intelligent, Intense, Profound, Resonant  Lucile",""," April 26th, 2017","See it if you like good theater","Don't see it if you don't like good theater"
"292","82","Absorbing, Great acting, Thought-provoking, Entertaining  Member 86f53f4b",""," April 24th, 2017","See it if You want to see the stars in the show: Danny DeVito, Mark Ruffalo, and Tony Shalhoub and you enjoy stories about dysfunctional families.","Don't see it if Are irritated by stories of dysfunctional families and/or the competition between two brothers."
"293","75","Great acting, Intelligent, Confusing, Slow  Barbara H 6318",""," April 24th, 2017","See it if You love Mark Ruffalo, Danny DeVito and/or Tony Shaloub. They are all terrific, but they are the only reasons to see this play.","Don't see it if You don't like the actors. On its own, Arthur Miller's play is a bit dull and slow moving. Atypically for Miller, no one dies.="
"294","78","Funny, Intelligent, Intense, Dated, Entertaining  Justin 7102",""," April 23rd, 2017","See it if You are a fan of Danny Devito and Mark Ruffalo or want to see a powerful drama that is extremely funny at times.","Don't see it if You do not like story lines that are dated as this play was set like most Miller dramas in the mid 20th century."
"295","100","Great acting, Intense, Thought-provoking, Must see  Sukdeo R",""," April 19th, 2017","See it if Great acting the cast had me engulf the whole time, great story, watching Danny Devito eat a hard boiled egg was amazing","Don't see it if you want to see singing and dancing="
"296","100","Absorbing, Ambitious, Delightful, Enchanting  Kaitlin 4",""," April 19th, 2017","See it if DANNY SEVITO","Don't see it if AAAAAH"
"297","88","Great acting, Intelligent, Relevant, Entertaining, Great staging  ArtJL",""," April 19th, 2017","See it if Want to explore Miller's fascination with the American success quest and disappointment and intro family rivalry; superb DeVito; well acted","Don't see it if You find that complaining and intro family rivalries can be often too much whining; you don't like DeVito or Ruffalo"
"298","89","Dizzying, Great acting, Intelligent, Intense, Engaging  kawh",""," April 15th, 2017","See it if You like a slow play offering much food for thought performed by first rate actors.","Don't see it if you find family drama too difficult or tiresome for a night out.=Also I couldn't get to a cup of coffee before the play and STILL was able to stay wide awake. High praise, indeed!...<U+00A0>Read more Read less="
"299","92","Absorbing, Intense, Must see, Profound  kat 6",""," April 15th, 2017","See it if you like engaging discourse","Don't see it if you prefer musicals only="
"300","88","Absorbing, Intelligent, Thought-provoking, Relevant  Diane E 7097",""," April 7th, 2017","See it if like the stellar cast","Don't see it if you are looking for light entertainment="
"301","79","Absorbing, Ambitious, Great acting, Dated, Entertaining  Member 931797e1",""," April 5th, 2017","See it if the acting was great","Don't see it if Always walk away sad after seeing an Arthur Miller play, even though you know it will be such, it still is depressing.="
"302","98","Absorbing, Great acting, Masterful  martin 7095",""," April 5th, 2017","See it if If you love Arthur Miller, want to see a great plan relevant to any life, that has extraordinary acting. I memorable night at the theater","Don't see it if You don't want to see a drama, unless you go for the experience of seeing two great performances, by Danny De Vito and Tony Shaloub="
"303","85","Absorbing, Great acting, Intense  AnnieB",""," April 4th, 2017","See it if you want to see great actors performing the works of a great playwright.","Don't see it if you prefer a lot of action. This play moves slowly, but with purpose."
"304","85","Absorbing, Great acting, Intense, Great writing, Entertaining  NickCalabs",""," April 3rd, 2017","See it if You enjoy dramas and intense argumentative acting.","Don't see it if You can't follow quality dialogue.="
"305","85","Funny, Absorbing, Intense, Slow, Thought provoking  Frank 5",""," April 2nd, 2017","See it if Want to see great acting from seasoned professionals. Danny DeVito was wonderful and added a great tough of humor to serious family issues.","Don't see it if You don't enjoy intense periods of serious drama that can feel a bit slow with actors making their points over and over.="
"306","86","Absorbing, Great acting, Thought-provoking  rob 6236",""," April 1st, 2017","See it if You are interested in ARTHUR Miller's works.","Don't see it if Want closure on what has transpired in the play="
"307","94","Absorbing, Intense, Relevant, Resonant, Riveting  Jeff 7091",""," April 1st, 2017","See it if You like brilliant writing that seems fresh after 50 years. Plus great acting","Don't see it if You are looking for light entertainment.="
"308","100","Absorbing, Great acting, Intelligent  Rita 7066",""," March 31st, 2017","See it if You enjoy great acting and serious subject matters","Don't see it if You like fluff="
"309","88","Funny, Great acting, Thought-provoking  Bucky B",""," March 30th, 2017","See it if You like Danny devito, he's hysterical.","Don't see it if You do not like plays, it can be a bit slow at times.="
"310","62","Good show, mixed acting  Richard 6318",""," March 30th, 2017","See it if You like Arthur Miller and shows about family issues. If you like Dannny DaVito (except for wavering accent)","Don't see it if You like actors who remember their lines (Ruffalo) or don't pull out their hackneyed bag of tricks (Shaloub) or are not overrated (Hecht)="
"311","96","Funny, Absorbing, Clever, Great acting, Entertaining  Emma 6312",""," March 30th, 2017","See it if You enjoy well written plays with great actors","Don't see it if No reason not to.="
"312","95","Great acting, Intelligent, Masterful  David T 6124",""," March 29th, 2017","See it if You like Arthur Miller","Don't see it if You're looking for a  feel good  show.="
"313","79","Thought-provoking, Slow, Dated, Entertaining  Wendy 6092",""," March 29th, 2017","See it if you get starstruck","Don't see it if you need face paced action="
"314","88","Delightful, Entertaining  Sue 7088",""," March 29th, 2017","See it if You like Danny Devito","Don't see it if Arthur Miller"
"315","85","Funny, Absorbing, Clever, Great acting, Entertaining  Edward 7087",""," March 28th, 2017","See it if People who appreciate really good acting and writing.","Don't see it if No if - go see it"
"316","82","Overrated  Caroline 6102",""," March 22nd, 2017","See it if You want to see Mark Ruffalo, Tony Shaloub on stage, want to see Danny DeVito's Bway debut, like Arthur Miller","Don't see it if You don't like dated dramas=Also Danny DeVito provides much needed comic relief in this not so classic Miller. Saw it in previews. Seemed a little tedious and some of it was a little implausible....<U+00A0>Read more Read less"
"317","59","Disappointing, Slow  Morrie",""," March 20th, 2017","See it if If you want some star power (in non-powering roles).","Don't see it if If you want your actors with lines learned (De Vito went up during the preview I saw).="
"318","73","Ambitious, Great acting, Great writing  Lise","  On","See it if Old school drama freak","Don't see it if you hate some hammy acting",""
"319","70","Funny, Uplifting, Entertaining  Cris 7102",""," April 27th, 2017","See it if Look that era of music","Don't see it if Don't like musicals"
"320","75","Funny, Great acting, Entertaining  Bernard G",""," April 26th, 2017","See it if You love Arthur Miller and want to see an brilliant funny performance by Danny DeVito","Don't see it if You have a hard time with the English language or you do not like drama"
"321","93","Funny, Clever, Masterful, Great staging  Laurie 6288",""," April 26th, 2017","See it if You are an Arthur Miller fan. Clever staging.","Don't see it if You don't like witty dialogue."
"322","70","Great acting, Intelligent, Thought-provoking, Indulgent, Dated  Lawrence 2",""," April 26th, 2017","See it if You enjoy good acting","Don't see it if You don't remember the '60s.="
"323","75","Absorbing, Great acting, Intense, Thought-provoking, Entertaining  Member 266343c2",""," April 24th, 2017","See it if You enjoy an emotional deep thought provoking show.","Don't see it if You like musicals or comedies.="
"324","77","Funny, Refreshing, Relevant, Slow, Entertaining  H H","  On","See it if you are a fan of Tony Shaloub.","Don't see it if You are looking for fast paced action and seasoned stage acting.",""
"325","38","Banal, Confusing, Disappointing, Excruciating, Overrated  Chip 7113",""," April 23rd, 2017","See it if you wan to see movie stars on stage.","Don't see it if you expect to understand what the actors are saying, with the exception of Danny DeVito.=Also I saw Arthur Miller's  The Price  last night with my friend Betsy. It has some really heavy hitting actors in it and the playwright is world class. The set was fascinating. You would think that with that mix of talent it would be a great show. And yet, it was not at all. The main problem for me was with the writing. Act one worked, but in act two, we both got lost. It was over-written and there wasn't very much at stake. As a result, it felt like Tony Shalhoub and Mark Ruffalo were trying to manufacture moments to raise the stakes. And it was so hard to understand Mark. He was very quiet, and he mumbled a lot of the time. Danny DeVito was the only actor who stood out for me. He was funny, and right on the money. I was really surprised to see an Arthur Miller play that didn't work. Act 1 was 50 minutes long. Act two was about three days long. I was disappointed....<U+00A0>Read more Read less="
"326","85","Clever, Exquisite, Great acting  Monika 7111",""," April 21st, 2017","See it if you like Miller's clever language. Also excellent acting by DeVito!","Don't see it if you don't like overly stylised acting (Ruffalo)="
"327","52","Excruciating, Slow, Dated, Great staging, Meh  PH Diamond",""," April 19th, 2017","See it if you like the cast. I like the staging","Don't see it if have issues with Mark Ruffalo's acting"
"328","100","Great acting  Eileen 7108","  On","See it if you want to see serious drama with well know actors","Don't see it if you want not to be provoked into thinking about family relationships",""
"329","90","Great acting  Jackquelinefontanes","  On","See it if intelligent, moving. the acting is exceptional.","Don't see it if u luke musicals",""
"330","90","Clever, Thought-provoking, Refreshing  ElizaKotowska",""," April 10th, 2017","See it if you don't mind seeing how the after effects of family troubles play out in the future","Don't see it if you don't enjoy family drama="
"331","79","Funny, Clever, Resonant, Great writing, Dated  Barry 7090",""," April 8th, 2017","See it if You like classic Arthur Miller that hasn't been overproduced.","Don't see it if There's no reason not to see it.. It's a good, solid show with some wonderful acting.="
"332","90","Absorbing, Ambitious, Edgy  Scott 6235",""," April 5th, 2017","See it if If you want a riveting evening of theatre with stellar acting.","Don't see it if If you prefer no film/television stars in your theatre productions.="
"333","94","Great acting, Intense  tara 7093",""," April 3rd, 2017","See it if You love Miller, blue-collar tragedy, and Monk.","Don't see it if You have an overactive bladder.="
"334","100","Absorbing, Great acting, Intelligent, Masterful, Great writing  Risa 7004",""," March 31st, 2017","See it if You Love or Like Tony Shalub, Danny DaVito or Mark Ruffalo. They were terrific. Emotional, sincere, funny.","Don't see it if if you don't like long shows. It was over 2 hours with a 15 minute intermission and it started at 8:00="
"335","100","Absorbing, Delightful, Great acting, Relevant, Entertaining  Phyllis S",""," March 30th, 2017","See it if Danny Devito &mark ruffalo were wonderful, everyone should see this","Don't see it if If you don't like drama="
"336","95","Absorbing, Ambitious, Clever, Great acting, Intelligent  Member 70406132",""," March 30th, 2017","See it if You enjoy great dramas about timeless topics...with some true to life family dynamics thrown in, and some good laughs to keep it fun!","Don't see it if You want to see something that is light hearted and simple.="
"337","72","Absorbing, Edgy, Great acting, Masterful, Great writing  Kennyactor",""," March 30th, 2017","See it if if you love great acting, great storylines.. family drama.","Don't see it if ... you have to enjoy plays; it's a dated piece... but with truly outstanding actors and acting.="
"338","95","Great acting, Thought-provoking, Masterful, Great writing, Great staging  Blake M 7089",""," March 30th, 2017","See it if You like all 3 A-list actors, witness Danny DeVito's Broadway debut, crave a good Arthur Miller interpretation, & crave a decent drama.","Don't see it if you don't appreciate simplicity, what it means to live through great acting, and yet at times witness A-listers fail in certain moments.="
"339","100","Absorbing, Great acting, Profound, Great writing, Great staging  Pam S 2","  On","See it if You enjoy great acting and amazing writing","Don't see it if Your dream Broadway show is a fluffy couple of hours if glitter and no substance",""
"340","78","Funny, Absorbing, Great acting, Must see, Entertaining  Beth 11",""," March 29th, 2017","See it if like great actors/acting like Jessica Hecht, Tony Shalhoub, Mark Ruffalo AND DANNY DEVITO -who steals the show!","Don't see it if don't like drawn out, thought provoking and plot driven dialogue."
"341","85","Absorbing, Great acting, Intelligent, Intense, Thought-provoking  Emily 7049",""," March 26th, 2017","See it if You appreciate Arthur Miller's writing. You enjoy thought provoking dramas. You want to see the live performances of fabulous actors.","Don't see it if You don't like theater with serious subjects and you are just looking to be entertained."
"342","85","Absorbing, Entertaining  Member 3a345777"," On","See it if A good story, plausible family drama, well acted.","Don't see it if If you have a hearing problem, get the listening device offered. Mark Ruffalo's voice doesn't carry.",""
"343","99","Absorbing, Epic, Great acting  Robin B 6365","  On","See it if You love great shows","Don't see it if You don't love great shows",""
"344","82","Funny, Captivating, Absorbing, Clever, Great acting  Karen 7102"," On","See it if You want to see a thinking piece with humor which is really just a cover for a deep family drama","Don't see it if Younger than baby boomers",""
"345","99","Absorbing, Clever, Delightful, Great acting, Entertaining  THEODORE 7100","  On","See it if real and touching particularly Mark Ruffalo who was very real and quietly tender","Don't see it if you like good theatre",""
"346","85","Clever  Sara 7089"," On","See it if you're a Danny Devito fan. He's spectacular.","Don't see it if n/a",""
"347","100","Exquisite, Great acting, Must see, Entertaining, Great singing  Barbara 708972"," On","See it if You are interested in art, enjoy great performances, enjoy seeing famous performers, are moved by the human experience","Don't see it if You don't want to think, you prefer song and dance musicals, have no Interest in art.",""
"348","75","Funny, Slow, Great staging  Rachel 7089"," On","See it if Danny DeVito makes you laugh.","Don't see it if Monologues aren't your thing.",""
"349","100","Absorbing, Great acting, Great writing  Robin R 7088"," On","See it if Excellent","Don't see it if t",""
"350","66","Dated  richard 44"," On","See it if you like danny devito","Don't see it if your expecting a surprise in the end",""
"351","85","Great acting, Slow, Entertaining  Debrs","  On","See it if You love Tony Shaloub You love Danny DeVito You love Mark Ruffalo You enjoy Arthur Miller plays","Don't see it if You like a fast moving plot You don't mind a very slow first act Arthur Miller plays are not your thing",""
"352","80","During previews Great acting, Great writing  Bonnie E 6301",""," March 15th, 2017","See it if See it because it's written by Arthur Miller and you should take every opportunity to see any Miller play. Plus great acting","Don't see it if you don't like Miller's plays="
"353","50","During previews Slow  Jana6240",""," March 15th, 2017","See it if you want to see an all-star cast.","Don't see it if you have ANYTHING else better to do with 2.5 hours. This is so incredibly slow and goes nowhere. IMO the great cast isn't enough to save it.="
"354","80","During previews Absorbing, Great acting, Intelligent, Masterful, Entertaining  Hopalong",""," March 15th, 2017","See it if You appreciate great classics from Arthur Miller. The cast is great.The interactions between Ruffalo and Shalhoub are worth the ticket price","Don't see it if Plays involving family dynamics and long standing disputes are not for you. This is a play that requires your complete attention.="
